{
  "control_stride_samples": 240,
  "duration_samples": 96000,
  "metadata": {
    "purpose": "weave breathing trajectory etude",
    "strict_transport": "false",
    "surface": "example-json"
  },
  "sample_rate_hz": 48000,
  "schema_version": "trajectory-program-v1",
  "tracks": [
    {
      "contract": {
        "maximum": 0.45,
        "metric_weight": 1.0,
        "minimum": 0.0,
        "state_semantics": {
          "kind": "fixed_capacity"
        },
        "unit": "radian"
      },
      "coordinate": "string.couple",
      "interpolation": "cosine",
      "knots": [
        {
          "at_sample": 0,
          "value": 0.12
        },
        {
          "at_sample": 57600,
          "value": 0.42
        },
        {
          "at_sample": 96000,
          "value": 0.18
        }
      ]
    },
    {
      "contract": {
        "maximum": 1.0,
        "metric_weight": 1.0,
        "minimum": 0.0,
        "state_semantics": {
          "kind": "fixed_capacity"
        },
        "unit": "ratio"
      },
      "coordinate": "string.body",
      "interpolation": "smootherstep",
      "knots": [
        {
          "at_sample": 0,
          "value": 0.3
        },
        {
          "at_sample": 48000,
          "value": 0.76
        },
        {
          "at_sample": 96000,
          "value": 0.38
        }
      ]
    },
    {
      "contract": {
        "maximum": 1.0,
        "metric_weight": 0.5,
        "minimum": 0.0,
        "state_semantics": {
          "kind": "fixed_capacity"
        },
        "unit": "ratio"
      },
      "coordinate": "string.curvature",
      "interpolation": "smoothstep",
      "knots": [
        {
          "at_sample": 0,
          "value": 0.2
        },
        {
          "at_sample": 48000,
          "value": 0.82
        },
        {
          "at_sample": 96000,
          "value": 0.28
        }
      ]
    },
    {
      "contract": {
        "maximum": 20.0,
        "metric_weight": 0.05,
        "minimum": 0.0,
        "state_semantics": {
          "kind": "fixed_capacity"
        },
        "unit": "hertz"
      },
      "coordinate": "string.orbit_hz",
      "interpolation": "cosine",
      "knots": [
        {
          "at_sample": 0,
          "value": 0.22
        },
        {
          "at_sample": 48000,
          "value": 1.4
        },
        {
          "at_sample": 96000,
          "value": 0.31
        }
      ]
    },
    {
      "contract": {
        "maximum": 1.2,
        "metric_weight": 1.0,
        "minimum": 0.8,
        "state_semantics": {
          "kind": "fixed_capacity"
        },
        "unit": "ratio"
      },
      "coordinate": "string.pitch_ratio",
      "interpolation": "linear",
      "knots": [
        {
          "at_sample": 0,
          "value": 1.0
        },
        {
          "at_sample": 96000,
          "value": 1.0594630943592953
        }
      ]
    }
  ]
}
